{
  "@type": "Process",
  "@id": "#stats-calculator",
  "name": "Statistics Calculator",
  "description": "Computes statistical metrics from raster data",
  "hasInput": [
    {
      "@type": "Input",
      "@id": "#input-raster",
      "name": "inputRaster",
      "description": "Input raster for statistical analysis"
    }
  ],
  "hasOutput": [
    {
      "@type": "Output",
      "@id": "#output-mean",
      "name": "meanValue",
      "description": "Mean pixel value"
    },
    {
      "@type": "Output",
      "@id": "#output-stdev",
      "name": "standardDeviation",
      "description": "Standard deviation of pixel values"
    },
    {
      "@type": "Output",
      "@id": "#output-histogram",
      "name": "histogram",
      "description": "Histogram of value distribution"
    }
  ]
}